{
  "$schema": "https://raw.githubusercontent.com/codenamekt/pi-laya-router/main/laya-router.schema.json",
  "provider": {
    "name": "openai",
    "baseUrl": "http://localhost:8787/v1"
  },
  "laya": {
    "url": "http://127.0.0.1:8811",
    "model": "english",
    "timeoutMs": 3000
  },
  "fallback": {
    "enabled": true,
    "model": "google/gemini-3.5-flash-lite",
    "timeoutMs": 8000,
    "assumedConfidence": 0.8
  },
  "thresholds": {
    "adopt": 0.55,
    "switch": 0.7,
    "fast": 0.9,
    "margin": 0.15,
    "streak": 2,
    "cooldownTurns": 3,
    "compactMinTokens": 24000
  },
  "autoModel": {
    "contextWindow": 200000,
    "maxTokens": 32768
  },
  "chain": {
    "retryAfterMs": 300000,
    "failover": true
  },
  "defaultRole": "coding",
  "logPath": "~/.pi/agent/laya-router/decisions.jsonl",
  "roles": {
    "coding": {
      "name": "Coder",
      "description": "write, edit, fix or refactor code; implement a change; make tests pass; run commands to get code working",
      "hint": "Act as an implementer: make focused, correct code changes, read before editing, and verify with tests or a dry run.",
      "models": ["google/gemini-3.7-flash", "minimax/minimax-m3"],
      "skills": ["coder"]
    },
    "planning": {
      "name": "Planner",
      "description": "design, architecture, trade-offs, step-by-step plans, research or investigation before building, deciding an approach",
      "hint": "Act as a planner: understand the problem deeply, explore the codebase, weigh trade-offs, and produce a numbered plan before touching code.",
      "models": ["minimax/minimax-m3", "google/gemini-3.7-flash"],
      "skills": ["planner"]
    },
    "ui_ux": {
      "name": "Designer",
      "description": "layout, styling, visual design, components, colors, copy, accessibility, front-end look and feel",
      "hint": "Act as a UI/UX implementer: care about layout, spacing, states, accessibility and copy; check the result visually when possible.",
      "models": ["google/gemini-3.7-flash"],
      "skills": ["designer"]
    },
    "chat": {
      "name": "Chat",
      "description": "questions, explanations, small utility tasks, casual conversation",
      "hint": "Answer directly and briefly; no tools unless needed.",
      "models": ["google/gemini-3.5-flash-lite", "google/gemini-3.7-flash"],
      "skills": []
    }
  }
}
